-- With SET NO_BROWSETABLE ON the primary key columns of the base tables
-- that a SELECT does not select are added to the result as hidden columns
-- (marked HIDDEN in the COLINFO token; the driver of this test shows them).
CREATE TABLE babel_browse_hk_terminal (TerminalNr INT NOT NULL PRIMARY KEY, Name VARCHAR(30), Typ INT)
GO

CREATE TABLE babel_browse_hk_termtyp (TermTypID INT NOT NULL PRIMARY KEY, HerstellerID INT)
GO

CREATE TABLE babel_browse_hk_tag (Jahr INT NOT NULL, Tag INT NOT NULL, persnr INT, Feiertag INT, CONSTRAINT pk_babel_browse_hk_tag PRIMARY KEY (Jahr, Tag))
GO

CREATE TABLE babel_browse_hk_nokey (a INT, b INT)
GO

INSERT INTO babel_browse_hk_terminal VALUES (1, 'T1', 7), (2, 'T2', NULL)
GO
~~ROW COUNT: 2~~


INSERT INTO babel_browse_hk_termtyp VALUES (7, 99)
GO
~~ROW COUNT: 1~~


INSERT INTO babel_browse_hk_tag VALUES (2026, 5, 3, 0), (2026, 6, 3, 1)
GO
~~ROW COUNT: 2~~


INSERT INTO babel_browse_hk_nokey VALUES (1, 2)
GO
~~ROW COUNT: 1~~


CREATE VIEW babel_browse_hk_v AS SELECT persnr, Feiertag FROM babel_browse_hk_tag
GO

-- without the setting nothing is added
SELECT t.Name, tp.HerstellerID FROM babel_browse_hk_terminal t LEFT JOIN babel_browse_hk_termtyp tp ON tp.TermTypID = t.Typ WHERE TerminalNr = 1
GO
~~START~~
varchar#!#int
T1#!#99
~~END~~


SET NO_BROWSETABLE ON
GO

-- the keys of both tables of a join
SELECT t.Name, tp.HerstellerID FROM babel_browse_hk_terminal t LEFT JOIN babel_browse_hk_termtyp tp ON tp.TermTypID = t.Typ WHERE TerminalNr = 1 ORDER BY TerminalNr
GO
~~START~~
varchar#!#int#!#int#!#int
T1#!#99#!#1#!#7
~~END~~


-- a two-column key, a column selected twice, old-style join, ORDER BY a column that is not selected
SELECT i.persnr, i.Feiertag, i.Feiertag FROM babel_browse_hk_tag i, babel_browse_hk_terminal m WHERE m.TerminalNr = i.persnr - 2 AND i.persnr = 3 ORDER BY i.Tag DESC
GO
~~START~~
int#!#int#!#int#!#int#!#int#!#int
3#!#1#!#1#!#2026#!#6#!#1
3#!#0#!#0#!#2026#!#5#!#1
~~END~~


-- a key column that is selected, also with an alias, is not added again
SELECT TerminalNr, Name FROM babel_browse_hk_terminal ORDER BY 1
GO
~~START~~
int#!#varchar
1#!#T1
2#!#T2
~~END~~


SELECT TerminalNr AS nr, Name FROM babel_browse_hk_terminal ORDER BY 1
GO
~~START~~
int#!#varchar
1#!#T1
2#!#T2
~~END~~


SELECT * FROM babel_browse_hk_tag ORDER BY Tag
GO
~~START~~
int#!#int#!#int#!#int
2026#!#5#!#3#!#0
2026#!#6#!#3#!#1
~~END~~


-- no key, a view, a subquery: nothing to add
SELECT a FROM babel_browse_hk_nokey
GO
~~START~~
int
1
~~END~~


SELECT persnr FROM babel_browse_hk_v
GO
~~START~~
int
3
3
~~END~~


SELECT x.Name FROM (SELECT Name FROM babel_browse_hk_terminal) x ORDER BY 1
GO
~~START~~
varchar
T1
T2
~~END~~


-- not for aggregates, DISTINCT, set operations
SELECT COUNT(*) AS n FROM babel_browse_hk_tag
GO
~~START~~
int
2
~~END~~


SELECT persnr, MAX(Feiertag) AS f FROM babel_browse_hk_tag GROUP BY persnr
GO
~~START~~
int#!#int
3#!#1
~~END~~


SELECT DISTINCT persnr FROM babel_browse_hk_tag
GO
~~START~~
int
3
~~END~~


SELECT Name FROM babel_browse_hk_terminal UNION ALL SELECT Name FROM babel_browse_hk_terminal ORDER BY 1
GO
~~START~~
varchar
T1
T1
T2
T2
~~END~~


-- not for an assignment, a cursor, SELECT INTO, INSERT ... SELECT, a subquery in a condition
DECLARE @v INT
SELECT @v = persnr FROM babel_browse_hk_tag WHERE Tag = 5
SELECT @v AS v
GO
~~START~~
int
3
~~END~~


DECLARE @p INT
DECLARE c CURSOR FOR SELECT persnr FROM babel_browse_hk_tag ORDER BY Tag
OPEN c
FETCH NEXT FROM c INTO @p
SELECT @p AS p
CLOSE c
DEALLOCATE c
GO
~~START~~
int
3
~~END~~


SELECT Name INTO babel_browse_hk_into FROM babel_browse_hk_terminal
GO
~~ROW COUNT: 2~~


SELECT * FROM babel_browse_hk_into ORDER BY 1
GO
~~START~~
varchar
T1
T2
~~END~~


INSERT INTO babel_browse_hk_nokey SELECT persnr, Feiertag FROM babel_browse_hk_tag
GO
~~ROW COUNT: 2~~


SELECT * FROM babel_browse_hk_nokey ORDER BY 1, 2
GO
~~START~~
int#!#int
1#!#2
3#!#0
3#!#1
~~END~~


SELECT Name FROM babel_browse_hk_terminal WHERE Typ IN (SELECT TermTypID FROM babel_browse_hk_termtyp)
GO
~~START~~
varchar#!#int
T1#!#1
~~END~~


-- in a procedure and with sp_executesql
CREATE PROCEDURE babel_browse_hk_p @nr INT AS SELECT Name FROM babel_browse_hk_terminal WHERE TerminalNr = @nr
GO

EXEC babel_browse_hk_p 2
GO
~~START~~
varchar#!#int
T2#!#2
~~END~~


EXEC sp_executesql N'SELECT Name FROM babel_browse_hk_terminal WHERE TerminalNr = @nr', N'@nr INT', 1
GO
~~START~~
varchar#!#int
T1#!#1
~~END~~


-- the rows can still be updated with the key
UPDATE babel_browse_hk_terminal SET Name = 'T1a' WHERE TerminalNr = 1
GO
~~ROW COUNT: 1~~


SELECT Name FROM babel_browse_hk_terminal ORDER BY TerminalNr
GO
~~START~~
varchar#!#int
T1a#!#1
T2#!#2
~~END~~


SET NO_BROWSETABLE OFF
GO

SELECT t.Name, tp.HerstellerID FROM babel_browse_hk_terminal t LEFT JOIN babel_browse_hk_termtyp tp ON tp.TermTypID = t.Typ WHERE TerminalNr = 1
GO
~~START~~
varchar#!#int
T1a#!#99
~~END~~


DROP PROCEDURE babel_browse_hk_p
GO

DROP TABLE babel_browse_hk_into
GO

DROP VIEW babel_browse_hk_v
GO

DROP TABLE babel_browse_hk_nokey
GO

DROP TABLE babel_browse_hk_tag
GO

DROP TABLE babel_browse_hk_termtyp
GO

DROP TABLE babel_browse_hk_terminal
GO
